funny,user_id,review_id,text,business_id,stars,date,useful,type,cool
0,kEH9rD6yJbGYcvp9_2RKrQ,NkJM5LxehFqgsIB7LPBiCg,"I ate at Khotan tonight with my husband, sister-in-law and her husband. We were there to use our Groupons before they expired.The service was really good. So was the lighting. We ordered the sliders, Tom Yum with chicken and the crispy asparagus to start. The sliders were pretty darn tasty with a side of pickled ginger that our server recommended. The Tom Yum was really good too. The asparagus came out ice cold. They brought us another one, but it still wasn't great hot. The coating is way too thick. We all agreed that they use Rice Krispies for the ""fry.""

For dinner, we ordered the Pad Thai (awesome), Khotan beef (decent), and crispy walnut shrimp. All of us like walnut shrimp from Ping Pang Pong and China Mama. We were expecting it to be hot. It was cold. Apparently, that's the way they serve this dish - fried cold shrimp. Once we knew, it wasn't that bad on the bed of vinegary salad. Just wasn't what we were expecting.

Our dessert of mini-cupcakes was comped. The worst cupcakes I've ever had. Three cupcakes - mango, coconut and chocolate, each with their own sauce. I really, really wanted to like them. They didn't taste fresh and were too cold. The cake wasn't fluffy and was really dense. 

The restaurant is beautiful. Worth a try. Don't expect miracles.",4uiijOUDzc-DeIb2XcKW_A,3,2011-01-08,1,review,0
3,24hyqUROHABynDLYTUpqkQ,vbuArRtzxYv6c359wj07mA,"This place is weird.  So we were greeted by the hostess in front who looked like she was wearing butt pads.  No skinny Cambodian-looking girl would have an ass that sticks out ten inches from her back unless she stuck a basketball in there, seriously.  Then she told us to go upstairs because that's where the real restaurant is at and we were again greeted by another Asian hostess. While walking upstairs, you would feel like you're in a bank's safe box room because seriously, that's what it looks like, no joke.  Fun to play with, but weird.  Am I missing some sort of cultural significance here? 

The place is dark with small tables, chairs and booths.  It took them ten minutes to hand us the menus after being seated which I thought was incredibly appalling because I'm sure they didn't forget about us.  They have candles on the tables which made it kinda uncomfortable because it seemed too romantic for our own goods (We were hungry and randomly walked into this place).  I ain't gonna lie, the food was good!  We ordered some noodles which tasted like mixed flavors of Chinese and Italian.  Surprise, surprise, it came in a tiny portion that can easily be confused as an appetizer.  WTF mang.  There were just too many selections on the menu (sarcasm) so I ordered an eye roll.  For more than a dub, it's not worth it.  But compared to other rolls I've had at other sushi places, this roll melted in my mouth with just the right amount of flavor, MmmM.  As long as its good, I like it.  

I liked how our waiter came back to refill my friend's drink a couple times without being asked.  I like attentiveness.  I like staffs who pretends to be genuine as good as they're faking it.  Having missed our menus for the first ten minutes, the service is above average. 

Even if money grew on my orange tree, I wouldn't come here again though.",4uiijOUDzc-DeIb2XcKW_A,2,2010-01-26,0,review,0
0,iUHPgpGXuJ-e8jXEhvK-AA,4RN8VIj5iY8Jrx3UxTzEjw,"I'll echo what others have said.  The service was poor.  This is a $6 million upfit and it's gorgeous.  The food is good, but not spectacular like the atmosphere.

Lots of potential here in the front and back of house.",4uiijOUDzc-DeIb2XcKW_A,3,2010-11-23,1,review,0
0,jIjC8F9Xiz7R5M-krH6OGg,H8SsK_SsLZSh6XycXxlINw,"What a waste of time and money.  We had dinner thinking that the chef from Social House was still there but I guess I should have read the other reviews posted by yelpers.  I guess if I had to describe the restaurant it would by con-fusion...horrible creations that make you think twice about eating there (salmon parmesan roll, crab lo mein Alfredo, wtf?).  Terribly expensive and it seemed that the staff didn't care too much about what was going on around them.",4uiijOUDzc-DeIb2XcKW_A,1,2009-12-04,0,review,0
0,HvquD8QalzpQlbXK-1KYlQ,ws3sKm5MrtZEDEsjCgOAJg,Not worth the money. Bad drinks and equally bad overpriced food. The pay roll was bland and possibly the worst I've ever had. It made the $35 roll taste even worse. The mongolian beef is better at P F Changs.Service was good. Decor was very nice. It takes alot  for me to say these things about any place. Good luck.,4uiijOUDzc-DeIb2XcKW_A,2,2011-04-22,0,review,0
0,3etKdarpGqQYpoLENXKt6A,6ye4tUGnj1lmhm_kvK_sPg,"Recently ate at Khotan. The food was quite good. I had the cashew chicken and my wife had sweet and sour chicken. While somewhat expensive, and the service a bit slow, it was a good experience overall especially with the Groupon discount saving us $25.",4uiijOUDzc-DeIb2XcKW_A,4,2011-03-17,0,review,0
0,53bZ_EsXH71L7iFs5MP9_w,maELoO1vbOSzztlEgCdDWQ,"Much MUCH better as Social House.  What the hell was TI thinking?  SH was more Japanese influenced, I would say Khotan is more Chinese influenced, with a Japanese pricetag.  

Grub:
*Jalapeno Hamachi, not as buttery & fresh as I'm used to, soy overpowered, I liked the battered jalapeno slices, great texture, $22
*Rainbow Roll, snow crab & fish were not fresh, $18
*Broccoli Beef, liked the Broccoli Rabe aspect, the beef was eh, $24
*Gai Lan, cooked nicely, & not too greasy, $6
*Crab Lo Mein Alfredo, really strange, like the powdered packet in Hamburger Helper, but oddly comforting, $14

This place is pretty pathetic, but they serve a mean cocktail & boast a great alfresco dining option.",4uiijOUDzc-DeIb2XcKW_A,2,2010-01-06,2,review,0
0,NoEI3raAUBkZKZMczZVlaQ,N6sCtNlRnXsvWX8TwNDIUg,"Was craving sushi after walking around the outdoor mall at Treasure Island. Just happened to come across this place. The food wasn't bad but it wasn't necessarily good either. Decor is nice, service is average, the bartender was cool though. For the price they charge I would pass on this place. I know it's Vegas but there's some standards you would expect based on the price and the food just didn't meet the standards in my opinion.",4uiijOUDzc-DeIb2XcKW_A,2,2010-03-15,0,review,0
0,PpTSDy5cQM25rqcI19yg0w,-PPFXSSsh-yi4LpBzr2MWQ,"Khotan is Closed and ""Senor Froggy"" resturant.",4uiijOUDzc-DeIb2XcKW_A,1,2012-10-16,0,review,0
0,HgmpXWF_p1WfG_Kq90jUkg,ilVcRwYNopvGus0yR_2zZw,"I came here back when it was social house, and now Khotan. I tell you it's like night and day. And I don't mean that in a good way. While the decor hasn't really changed much. The menu sure has and not for the better. My experience here while being social house was so wonderful. I figured regardless of the name changing I'd give it a shot. Boy was I wrong. Like I mentioned before the decor is still unique. Dim, sheik, very Asian like of course. But wait, they use to have a dj in the lounge area. Gone, go figure. And the waitresses from what I remember were a lot nicer. Anyway. I ordered a few sushi pieces, with some chicken like kabobs. I believe a salad. Had a few beers. Sushi was very Mediocre. Chicken was dry. Salad was salad. Can't really remember anything memorable from my meal. Aside from the overpriced food. A big disappointment. I doubt I'll be coming here again. Only reason I'm even giving this place 2 stars is because it was once social house. Anyway if over priced wanna be asian food is your gig. Along with half ass service. Be my guest.",4uiijOUDzc-DeIb2XcKW_A,2,2011-03-09,0,review,0
0,YLgDEG9vFIiHo5e3K_g0hQ,4zVgAV6cGM5i0RWzBh7n5g,"Mediocre food. 50$ for one person. I could have had better food at Panda Express. The orange peel chicken was cold and lacking flavor. The veggies in the dish tasted like they weren't washed before being cooked. Only good thing about this place is the atmosphere, it is the only reason I didn't give it 1 star.",4uiijOUDzc-DeIb2XcKW_A,2,2011-05-21,0,review,0
0,WOGd8Xxq0ya99vp8YWmA8g,Adf4hvwmXzsAGmQKAMMYpA,"You can IGNORE all the complaints regarding price as this restaurant (formerly Social House, and formerly Khotan Pan-Asian Cuisine) now goes by the name of Khotan Asian Bistro and has a NEW menu with lower prices.

More importantly, there a few restaurants in Las Vegas that offer a more impressive atmosphere.  Anyone comparing it to ""Panda Express"" or even ""PF Changs"" is simply not doing this place justice.  The modern and sleek decor hasn't changed too much from the days it was Social House except for the fact they have added some stunning jade and ivory sculptures on display.

Most importantly, the food presentation, taste and service are well beyond expectations for a ""reasonably"" priced restaurant on the Las Vegas Strip.

Can you get Asian food as good or better at a lower price down the street (Spring Mountain) in Las Vegas Chinatown?  Yes, of course, but no where near the same dining experience in terms of location, seating (indoor/outdoor), ambiance, and cool vibe.

I would challenge some of those that previously rated this place less than 4 to give it another try.  Unless you are a complete foodie-snob and/or have no clue what a ""normal"" price is for a Las Vegas Strip restaurant, it will be difficult to rate this dining experience lower than a 4.  Of course, that's IMHO.",4uiijOUDzc-DeIb2XcKW_A,5,2010-07-21,0,review,0
0,OuRxTH-PPuRzpmtWXkOavg,-VrIBSpMzFxdVeP04eMXZw,"We went there to celebrate our anniversary. When we called to book a reservation, they asked if it was for a special occasion. When we got there, no one congratulated us. No one seemed to care that we were even there. There were lots of staff walking around, but most of them seemed to be chatting amongst themselves. The food was ok, but not worth the $67 bill for 2 dishes and one drink. The jade exhibit was amazing and the atmosphere was good. It could have been better. We were interested in dessert, but got the impression that there was none, until we were asked after we finished dinner. I would have made room if I knew there was dessert.",4uiijOUDzc-DeIb2XcKW_A,2,2011-06-30,0,review,0
0,6gZBMMTC_47cDL_LDkr3ng,FTx10AG-Ipaldnb3A8ZMcg,"Came here for a friend's birthday dinner. It has a cool atmosphere, but it's super expensive and the food is so-so for the price you pay. It's also super dark, so it's hard to read the menus. This is probably to hide that you're paying $45 for a few pieces of steak. 

If you're here at the right time, Treasure Island's pirate show will play right outside your window, so you can listen to the cannons and fireworks go off while you're eating a romantic dinner. That could be a good or bad thing depending on your personality.",4uiijOUDzc-DeIb2XcKW_A,3,2009-09-16,2,review,0
1,cUZw26_XQSpwX3gd9GVKtA,AZJx5c1QV8rKDTEL6-GTng,"While looking for a restaurant on the strip that had excellent decor and a romantic atmosphere, but at the same time a reasonable price, i found Khotan.
The service was good, our waiter was very social and always kept our drinks filled. I tried out the orange peel beef and my girlfriend tried out the Khotan beef both were very delicious dishes, but me being a fat ass was still hungry after since there isn't very much in the plate.

what i suggest: 
1. Eat out in the patio if you are going to be there at nightfall, Khotan is right above the pirate show at T.I.

2. Chicken lollipops! really good appetizer",4uiijOUDzc-DeIb2XcKW_A,4,2010-08-13,1,review,1
0,OpAfXeNL4kJA59PoUFU7ew,yfF0bUmR65iOGw0QefGSPA,"My four stars are for the lounge area and the food.  The service in the dining area was lame.

The lounge was great.  During happy hour (5-7PM) there are drink and app specials. And since ISLA was packed to the gills, my fella and I decided to check out Khotan.  The barkeep was friendly and chatted us up while we sat and watched an NBA game. 

We were so pleased with the service and food (spicy tuna roll -- YUM) that we decided to come back a couple hours later for dinner.

The dining area is upstairs.  Getting up there is quite a sight - floor to ceiling gold drawers. Pretty impressive.  Once seated (inside) we quickly realized we should have sat on the patio.  The inside of the restaurant was dark.  Not mood-making-romantic dark.  More like push-that-candle-here-so-I-can-read-the-menu dark. Oh well.

We ordered a couple entrees (pad thai and singapore style noodles) and a Tom Yum soup.  The soup was super tasty and chocked full of amazingly tender chicken.  My one gripe about the soup...there were pieces of fried scallion (or something...I couldn't really see what it was) that was really fiberous and unpleasant to eat.  I ended up picking it out of my soup.

The pad thai was to die for. Super tasty and a really great portion.  I did raise an eyebrow at the price ($15) - but hey, it's Vegas baby.  My fella loved the singapore style noodles.  He would have licked the plate clean if he wasn't so classy.

We enjoyed a two-for-one cocktail with our complimentary voucher from Treasure Island and both opted for the ginger mojito. (Give me anything with Canton in it and I'm set. Yum.) 

So - let's talk about the service. The servers were polite and great when we saw them.  We had four different servers at one point and before any of them could get to our table to take our order, the barkeep came by since we had been sitting (unattended to) for about twenty minutes. This could have definitely had to do with the fact that for a while we were the only ones inside the dining area, but the servers never acknowledged the crap service.  A simple, ""Sorry 'bout the wait"" would have sufficed.  Oh well.

Good thing the food is so good. I'm dreamin about that pad thai. Mmmmm...",4uiijOUDzc-DeIb2XcKW_A,4,2010-11-02,1,review,1
0,F75cB0AgEhc-mtM18B8EFw,Uw24JCOsOdkSUqq6EPogBw,"This place was really good when it was Social House, now its just an expensive place to get sub-par food.  The place reeks like Ed Hardy perfume (below the restaraunt).  The service was ok, but the food was over priced and not up to Vegas quality standards.  I would definietly try somewhere else and not waste my money here again.",4uiijOUDzc-DeIb2XcKW_A,1,2009-11-30,0,review,0
0,E5glLZ1mCo10-zqq3Bj13w,HTolWbNJUULt5u_bWne1IQ,"The best description I can give about this restaurant is that it is the Panda Express of asian food and not worth the price.

For appetizer we had the crispy asparagus. It was just japanese crackers deepfried around asparagus. Too weird of a texture but okay to eat. Only 6 sticks. So to me, 6 asparagus heads is not worth that price.

I got the lobster curry. Again, for the price, it was not worth. i can get thai green curry for $5.95 down the street and throw in some steamed lobster and get the same effect. 

hubby got korubuta pork chop. okay, but have had much better elsewhere.

the place is also really dark, to the point where you cannot read your menu. you have to put the menu an inch away from the candle on your table. lame.

and the TI sirens show in the background is VERY annoying.

skip this place. and TI, please don't make lame asian restaurants. it's an insult to the main demographic of your casino.",4uiijOUDzc-DeIb2XcKW_A,2,2010-02-22,1,review,0
0,GZuBQoHtz39pIDsNh4EQXA,aWizkxCmuMZaeOEOuxyESw,"sehr guter Service, schnell und kompetent!
coole Mitarbeiter",5WoHYemsAjuK85AOcGwEJg,4,2013-03-12,0,review,0
0,wU1V11JqKhsSptKMsnEDEg,3Q-7kthW9izOrztE5DWUdw,"Lieber zu Arlt und vernnftig, gnstig alles fr den PC
als zu ich bin doch nicht bld",5WoHYemsAjuK85AOcGwEJg,5,2008-09-01,0,review,0
0,uZtSv8Rgi4-0BBvz4YbH9Q,434UggWUy1Ku5x-s1UH2og,"Der Arlt ist oftmals der Computerladen um die Eck, wenn man dringend etwas braucht. Doch empfiehlt es sich vorher Produkt und Preis online zu prfen, denn leider ist auch das Personal sehr schwankend in ihrer Qualitt",5WoHYemsAjuK85AOcGwEJg,3,2012-01-29,0,review,0
0,FCzzkuhMrQ-pWYDA_fPmkg,xzjuJ4Sdc8MzYVtvnYJKiQ,"Kompetente Beratung, super Preise und kulanter Service. Gerne wieder!",5WoHYemsAjuK85AOcGwEJg,5,2011-06-08,0,review,0
0,LMhTti4tnUvPwON8yREDcg,9P_dPGmnyT4neDi1cXGCOw,"Wenn ich meine Computerteile und -zubehr nicht beim K&M hole, dann beim Arlt. Beide schenken sich recht wenig, beide sind gut. Allerdings ist Arlt etwas teurer.",5WoHYemsAjuK85AOcGwEJg,4,2008-01-08,0,review,0
0,kKXjr2cCjPMQoX0OiB6XRA,hc_6jOJ3RXw73LgbnlvjlQ,"Fast immer erste Wahl bei PC-Zubehr. Der Service ist ok und auch bei Reklamationen gabs meinerseits nie Probleme. Muss allerdings sagen das es im Bekanntenkreis schon massieve Probleme bei Garantiefllen gab, daher nur 4 Sterne.",5WoHYemsAjuK85AOcGwEJg,4,2011-02-20,0,review,0
0,V1chaUDzuPh7zLZVfnqQxA,VIJJmHxrmfZQDeFG1DvtsQ,"Best place for fries! Breakfast sandwiches! Hot Meals! I didn't realize everything is made in house from scratch!!!!!! From the hummus, salads, pasta and pasta sauce!!!! The Chicken Shawarma  sandwich is like nothing you have had before! It's juicy, fresh and huge!!! Also! Ladies it doesn't fall apart!!!! Great lunch place!!!! I personally am a fan of the falafel sandwich! They stick French fries in it for me!!! Also, the people that work there are very sweet, humble and down right good! 

This place is more like family! They know everyone by name!  You walk in and instantly greeted with great service. They give you time to decide and help you customize if needed. 

On several occasions I have gone into the restaurant in a rush between meetings and they are fast!!!! Which I appreciate. I have brought in a few clients with me and they never disappointed with the food. Always consistent. 

If you are in the area.. Give them a try!!!! They ROCK!!!!!!",2cl9TETYE3CdzljPtdIbjA,5,2014-11-25,0,review,0
0,zsV1V_8FZbVMzIMVF-J3Jw,j7JswOZSTRmtSBXQfqoC3A,I used to come to this joint when i worked nearby. It is family owned and the food is absolutly exquisite. They get alot of regulars and have a very loyal clientele. Friendly staff.,2cl9TETYE3CdzljPtdIbjA,5,2015-01-07,0,review,0
1,G8FR2qnN7CcdP8Q9snLhQg,u5NBtqEHaH3gqMZMWjDRbw,First time going here. Great food. I had a whole wheat chicken shawarma. Was really good and refreshing and filling. Will be going back in the future.,2cl9TETYE3CdzljPtdIbjA,4,2013-07-31,1,review,1
0,GQNeutlSdO8OfOUWNUas0Q,FfmIzwjKbVDDa3LpWLz3Ew,"This restaurant is all about good home cooking. Wonderful spices, excellent quality and care taken. Lots of repeat customers are seen at Sami's!!
I love their coleslaw and very fresh ingredients are used!!",2cl9TETYE3CdzljPtdIbjA,5,2016-02-09,0,review,0
1,3iq8oDotfNXL57CbqzaaAA,rJzBClqVToyTdrV8ZnUpeg,"Just to let everyone who reads this know, I didn't actually sign a lease here, and this review is basically just to tell you why.

The ""apartments"" which are actually condos for rent, aren't very nice.  The floor plan doesn't make any sense, and the place is really old.

The biggest issue that I had here was the staff.  They were rude and complete ignorant.  The woman that showed us around (more like pointed and told us to have a look while her lazy self watched us show our selves around) looked like she had just gotten out of bed and slipped on some flip flops.  The other guy that completely ignored us while we stood at the front entrance waiting to be helped while the other woman was in the middle of a meeting with some potential renters was in a pair of ripped jeans, an abercrombie shirt and flip flops!  COMPLETELY UNPROFESSIONAL.

One of the things that suprised me the most was the fact that the woman that showed us around brought her phone with her and started texting while ""showing"" us around.  It was only like a 10 minute walk, I think the texting could wait.

Happy to say, I won't be going back there ever again.",32S_SP-ZaVmQucdEY5ynlQ,1,2009-05-23,8,review,1
2,Q7p9asYQzdmOJTxhqAGjlw,UB79vfvriOv3PVksgdcMJg,"As a regular visitor to the Phoenix area, I have to disagree with the other negative reviewers.  I've stayed at Bella Terra a number of times over the past few years and I'm always impressed with the upkeep and cleanliness of the grounds.  In all of my visits, I've needed help from the staff only twice, but both times they've been helpful and attentive.

The facilities are well-maintained and the location is mere minutes away from golf courses, walking and biking trails, shopping and restaurants.  

Most of the neighbors have been quite friendly...the only disgruntled folks I've met are angry because their real-estate values have plummeted over the past few years.

I'm looking forward to my next visit.",32S_SP-ZaVmQucdEY5ynlQ,4,2010-09-20,1,review,0
0,p0RVQxuOSA2NV4Odv_kgWQ,CyuSk7yXMKFgzZqns7XtPA,"Living at the Bella Terra and having the front office as the property management has been a horrible experience.  I have had several major maintenance issues that have gone unresolved and I have had to pay to have them fixed myself.  This includes broken shower valves and stopped up sinks.  Additionally, the front office manager never returns phone calls and is completely unresponsive to requests.  If you rent here and don't use the front office as the property management it may be a better experience, but I would strongly recommend that no one rent here if the front office acts as the property management.   When my toilet wasn't working, I notified the front office on a Thursday and was told they couldn't have anyone out until the following Tuesday! Completely unacceptable.  This is only one of many examples.",32S_SP-ZaVmQucdEY5ynlQ,1,2013-08-04,2,review,0
0,t3G62CIef9uoS7BNvI8eEQ,H6M7v-Ev2JBd31NgRxr-qA,"No way would I live here again!  This is not a gated community for starters.  You should stay away just for that reason alone!  The pool is small.  The a/c units are  right next to the bedroom window.  If you are a light sleeper like I am, you are screwed!  I never even noticed it until I tried to get to sleep that first night and then it was too late!

The exercise room is a joke!  Many people bought condos here when the market dipped and some only paid around 50-70K.  That should tell you what kind of people live here.  A lot of these condos are rented out and the owners do not have any kind of criteria they have to abide by.  Two convicted felons ended up moving in next door to me and they played their music really loud ALL THE TIME.  I was scared to say anything so I just had to put up with it.",32S_SP-ZaVmQucdEY5ynlQ,1,2013-06-12,2,review,0
0,Lj4aiPE5RRIn5m1zgKSIQQ,0D3-2UM5-AEl5RdZ1Ggb2A,"Bring a sweater and leggings/pants with you, because this place is freezing! There's something wrong with their ventilation/air-conditioning system. It might be warmer if you sit next to the grill.

The sushi is always good but I've never had the grill. It's a great place to get together with friends, family or colleagues for any group event. Children's birthday parties are celebrated a lot here. I plan on celebrating mine here in September.",7HnlXTF9f29HOYfblGLIHQ,4,2013-05-30,0,review,0
0,luxGSQ8kNf7Q00DyBrLCgw,TAaRUOSSwJ_aqRNMlSNxxw,"It's always a fun time with the food cooked in front of you. Nice quality and decently healthy... Price point is a bit high, but it's fun from time to time.",7HnlXTF9f29HOYfblGLIHQ,4,2015-03-24,1,review,0
0,6YPfM_xcWZM4GjBvGvL8Mg,0b8Rl8NY1a3intA7fHH2Nw,"It is not just a meal ... It is fun evening with a delicious food and a great presentation .
I gave it 4 star because it is not at the same level of Benihana in Toronto and the US.
I believe it is the best available Japanese grill house in Montreal island .
It is a bit expensive because of the location.",7HnlXTF9f29HOYfblGLIHQ,4,2012-04-28,1,review,1
0,segRkXhf1vSCnEi_aHnGdg,NlLMeXZMLwbAQMYrWgMldA,"Toyo, Toyo, Toyo... where do I begin. I was first introduced to this place 4 years ago, for my friend's 18th birthday. We had an unbelievably fun time with the tempenyaki grills and a wonderful chef/performer. 

I came back another time for a company dinner (my suggestion, woo!) and they were able to accomodate close to 25-30 of us at 2 facing tables. We had another great performance by a chef and everyone left satisfied.

I've come back several times since, in much smaller groups. Unfortunately, the chefs never perform or make a spectacle for smaller parties only the large groups, pretty disappointing. Also, the food can be pretty bland if not seasoned perfectly - which has been the case the last couple of times.

It's also not really that cheap given the portions. Service is pretty decent at the tempenyaki tables - soup, salad and the meal for one price (rice included) for one price and the servers are usually quick to bring out this portion. Tempenyaki takes a little bit of time - so do not come in here if you're in a rush - they usually wait to fill up the whole table with small parties... which by the way, is incredibly awkward! 

I'm sure there are better tempenyaki places in Montreal, but Toyo will make do.",7HnlXTF9f29HOYfblGLIHQ,3,2012-02-05,1,review,0
0,2bfpsTEAuAsY93ELDBVr_A,ZqZSFxr0zFUkcs3fy2U75w,"Great staff, great location and great food.
The chefs are amazing and make the experience memorable. Great Japanese food. I would definitely recommend this restaurant for a date or even a party.",7HnlXTF9f29HOYfblGLIHQ,4,2014-06-25,0,review,0
0,F7JUBrCarN8nvmm0JGeIcg,xzIHAY0k6ZVWkuUc4iBJsA,the cook was really entertaining ! food was delicious and well seasoned and cooked. great for small groups !,7HnlXTF9f29HOYfblGLIHQ,5,2015-06-01,0,review,0
0,TZPsABv-sMnreTLwLsg9xg,PvUnXxsrxWJPd7XV-1fYTg,Had a great experience here. Our chef had lots of fun with the meal and put on a good show. Food was fantastic and a large portion. Great time all around.,7HnlXTF9f29HOYfblGLIHQ,4,2014-12-01,0,review,0
